{
  "schema": "h0_gctm_interface_static_feasibility_audit_v1",
  "audit_id": "h0_gctm_interface_static_feasibility_20260723",
  "audit_scope": "static_feasibility_only_no_runtime_authority",
  "terminal_order": [
    "H0_GCTM_STATIC_AUDIT_INVALID",
    "H0_GCTM_INTERFACE_STRUCTURALLY_INSUFFICIENT",
    "H0_GCTM_INTERFACE_STRUCTURALLY_FEASIBLE"
  ],
  "frozen_inputs": [
    {
      "role": "gctm_d1_terminal_acceptance",
      "identity_id": "gctm_d1_terminal_owner_acceptance_20260723",
      "path": "docs/modules/semantic/research/evidence/gctm_d1_canonical_execution_20260723/terminal_acceptance.json",
      "sha256": "1aa779f6d8e15f08ec9c3fa722a27b42efc1a8ec2129a431a76bc67cfe9e67e5"
    },
    {
      "role": "gctm_consumer_interface",
      "identity_id": "gctm_d1_substrate_agnostic_ranking_v1_consumer_interface",
      "path": "docs/modules/semantic/research/evidence/gctm_d1_substrate_agnostic_ranking_20260723/consumer_interface.json",
      "sha256": "45c16a6c8cf50d098b12cc8e4f1acbdcc846d0d431ad77f9fbe64bdb60bb57ce"
    },
    {
      "role": "gctm_compatibility_requirements",
      "identity_id": "gctm_d1_substrate_agnostic_ranking_v1_compatibility_requirements_v1",
      "path": "docs/modules/semantic/research/evidence/gctm_d1_substrate_agnostic_ranking_20260723/compatibility_requirements_matrix.json",
      "sha256": "25a2ca49dbfd6d9d8985681967beb3f4df51e2fc51901444f246c94e49fa7ddd"
    },
    {
      "role": "h0_consumer_compatibility_contract",
      "identity_id": "h0_gctm_consumer_compatibility_requirements_20260718",
      "path": "docs/modules/semantic/research/h0_gctm_consumer_compatibility_requirements_20260718.md",
      "sha256": "6cb37366a14129461e68c24e17cbeaada80d0cd7dccf1d0ea75ac102e997151a"
    },
    {
      "role": "h0_capture_abi",
      "identity_id": "h0_bridge_decision_trace_v2",
      "path": "scripts/tools/h0_bridge_decision_trace_schema_v2.json",
      "sha256": "5ea8bea16ab6f6916baebd486c3256100427ae823e2f7bac021ff1284254f9a2"
    },
    {
      "role": "h0_guarantee_registration_schema",
      "identity_id": "h0_gctm_guarantee_registration_v2",
      "path": "scripts/tools/h0_gctm_guarantee_registration_schema_v2.json",
      "sha256": "63af2eba012a248d769cde225ce28db404cefe592edc995a12d86af307419ff2"
    },
    {
      "role": "h0_guarantee_registration_validator",
      "identity_id": "verify_h0_gctm_guarantee_registration_66dc80e3",
      "path": "scripts/tools/verify_h0_gctm_guarantee_registration.py",
      "sha256": "66dc80e349756b2d72178517dd6c12add454e24fd8271cb707f6b5a2629641cf"
    },
    {
      "role": "h0_guarantee_candidate_fixture",
      "identity_id": "h0_gctm_guarantee_registration_candidate_sources_v2_fixture",
      "path": "tests/contract/fixtures/h0_gctm_guarantee_registration_candidate_sources_v2.json",
      "sha256": "dc8db5007832c68fd91ff980fac667c990cad0abd0e31cfb2373d387e277401b"
    },
    {
      "role": "gctm_theory",
      "identity_id": "gap_conditioned_stochastic_transition_spec_v1",
      "path": "docs/research/models/gap_conditioned_stochastic_transition_spec_v1.md",
      "sha256": "8401c90d8fe2766eb314a0f4eb55cad86d9a1ca3bbfacde8535b8eb55bc3ff6e"
    },
    {
      "role": "h0_capture_semantic_declaration",
      "identity_id": "headline_bridge_full_decision_capture_declaration_20260713",
      "path": "docs/modules/semantic/research/headline_bridge_full_decision_capture_declaration_20260713.md",
      "sha256": "602994a3a49f2fbb0e27bfe3f43a023064dff9df8bd9457f733628176c3ac816"
    },
    {
      "role": "h0_capture_record_types",
      "identity_id": "tracker_gpu_h0_record_types_898fa631",
      "path": "include/tracking/tracker_gpu.hpp",
      "sha256": "898fa631c40352c9bd1a9280ee0443113096bf2317c9be524af278ea71338de2"
    },
    {
      "role": "h0_capture_writer",
      "identity_id": "tracker_gpu_h0_capture_writer_e89934f6",
      "path": "src/tracking/tracker_gpu.cu",
      "sha256": "e89934f6a0dabcd1fa8359d4dc033330cdacfb75899f45e5b721bd2d55d92e45"
    }
  ],
  "derivation_definitions": [
    {
      "definition_id": "gctm_runtime_event_id_from_pair_key_v1",
      "definition_version": "1",
      "owner_class": "GCTM_DERIVED",
      "content_hash": "8eff05bfc1da00d1ea7654bfe89db659ef073c5d02bffa39ef6591a485fb5846",
      "expression": "event_id := canonical_tuple(seq, frame, lost_slot, lost_instance_uid); it groups all candidate pair rows for one lost runtime instance at one bridge event and is not a cross-event trajectory identity",
      "inputs": [
        {
          "name": "seq",
          "source_kind": "h0_candidate_field",
          "shape": "scalar",
          "unit": "opaque sequence id",
          "availability": "pair-record emission"
        },
        {
          "name": "frame",
          "source_kind": "h0_candidate_field",
          "shape": "scalar",
          "unit": "frame index",
          "availability": "pair-record emission"
        },
        {
          "name": "lost_slot",
          "source_kind": "h0_candidate_field",
          "shape": "scalar",
          "unit": "slot index",
          "availability": "pair-record emission"
        },
        {
          "name": "lost_instance_uid",
          "source_kind": "h0_candidate_field",
          "shape": "scalar",
          "unit": "opaque runtime-instance id",
          "availability": "pair-record emission"
        }
      ],
      "output": {
        "shape": "scalar",
        "unit": "opaque string id"
      },
      "causal_rule": "Uses only the current pair key at event formation; no label, entry-future, claim, or commit field participates.",
      "invalidation_set": [
        "h0_capture_abi_sha256",
        "h0_event_key_version",
        "lost_instance_uid_lifecycle",
        "gctm_runtime_event_grouping_definition"
      ]
    },
    {
      "definition_id": "gctm_physical_gap_from_operational_timing_v1",
      "definition_version": "1",
      "owner_class": "GCTM_DERIVED",
      "content_hash": "9a9901c03b401d0b46772f5ceacd2091ae22c4b7b89a8ff511b09975d14c7a7a",
      "expression": "g_phys := la - bridge_at + 1; require integer la >= bridge_at >= 1 and g_phys >= 1; la remains Delta_on and is never relabelled as g_phys",
      "inputs": [
        {
          "name": "la",
          "source_kind": "h0_candidate_field",
          "shape": "scalar integer",
          "unit": "frames",
          "availability": "pair-record emission at bridge fire"
        },
        {
          "name": "bridge_at",
          "source_kind": "h0_candidate_field",
          "shape": "scalar integer",
          "unit": "frames",
          "availability": "pair-record emission at bridge fire"
        }
      ],
      "output": {
        "shape": "scalar >= 1",
        "unit": "frames"
      },
      "causal_rule": "Both timing values exist no later than the candidate entry/bridge event; the formula is the frozen GCTM mapping and does not use a future-derived proxy.",
      "invalidation_set": [
        "h0_capture_abi_sha256",
        "h0_timing_semantics",
        "gctm_theory_sha256",
        "entry_endpoint_convention",
        "frame_time_unit"
      ]
    },
    {
      "definition_id": "gctm_m1_position_innovation_from_h0_snapshot_v1",
      "definition_version": "1",
      "owner_class": "GCTM_DERIVED",
      "content_hash": "a5da28845c68f4d0b24b2ace9424892dd832d459b8bd2bc35152a5186bba8c98",
      "expression": "For d=2, H=H_x, M1/CV and M2 inactive: residual_position := ([cand_anchor_x,cand_anchor_y] - ([lost_anchor_x,lost_anchor_y] + g_phys*[lost_velocity_x,lost_velocity_y])) / h_ref. The production operator offset from la is kept separate and fwd_r/bwd_r are not used as proxies.",
      "inputs": [
        {
          "name": "cand_anchor_position",
          "source_kind": "h0_candidate_field",
          "shape": "(2,)",
          "unit": "image pixels",
          "availability": "candidate entry endpoint, emitted at bridge fire"
        },
        {
          "name": "lost_anchor_position",
          "source_kind": "h0_candidate_field",
          "shape": "(2,)",
          "unit": "image pixels",
          "availability": "lost exit endpoint, emitted at bridge fire"
        },
        {
          "name": "lost_velocity",
          "source_kind": "h0_candidate_field",
          "shape": "(2,)",
          "unit": "image pixels per frame",
          "availability": "lost exit-causal snapshot, emitted at bridge fire"
        },
        {
          "name": "g_phys",
          "source_kind": "derived_object",
          "shape": "scalar >= 1",
          "unit": "frames",
          "availability": "derived at candidate entry endpoint"
        },
        {
          "name": "h_ref",
          "source_kind": "h0_candidate_field",
          "shape": "scalar > 0",
          "unit": "image pixels",
          "availability": "pair-record emission at bridge fire"
        },
        {
          "name": "mean_model_identity",
          "source_kind": "declaration_constant",
          "shape": "scalar identity",
          "unit": "enum",
          "availability": "declaration time before scoring"
        }
      ],
      "output": {
        "shape": "(d,)",
        "unit": "coordinate units of declared substrate"
      },
      "causal_rule": "The exit state is lost-side causal, y1 is the entry anchor, g_phys is exit-to-entry time, and M2 is explicitly inactive; no entry-future frame enters the mean.",
      "invalidation_set": [
        "h0_capture_abi_sha256",
        "h0_snapshot_semantics",
        "gctm_theory_sha256",
        "mean_model_identity",
        "coordinate_normalization_identity",
        "operator_offset_treatment"
      ]
    },
    {
      "definition_id": "gctm_total_innovation_covariance_canonical_c0_v1",
      "definition_version": "1",
      "owner_class": "GCTM_DERIVED",
      "content_hash": "69a553f016dfd7aa34f0c9dfe627610969dcd4a6a9d18afd69f2f6cc31b50066",